LEVEL1ID	LEVEL2ID	LEVEL3ID	LEVEL4ID	LEVEL5ID	Organization	Organization.fullname	AADD	IDlevel	LEV_1	ORG_1	LEV_2	ORG_2	LEV_3	ORG_3	LEV_4	ORG_4	pathString	I
22	210	323	0	0	TAG - DG, Policy Develop & Coord.	TAG - DG, Policy Develop & Coord.	T-DPD&C	3	CRNA	Crown-Indigenous Relations ...	TAG	Treaties and Aboriginal Gov...	T-DPD&C	TAG - DG, Policy Develop & ...			CRNA/TAG/T-DPD&C	1652
22	999	0	0	0	I cannot find my organizational unit	I cannot find my organizational unit	N/A	2									NA	1653
23	0	0	0	0	Immigration and Refugee Board of Canada	Immigration and Refugee Board of Canada	IRBC	1									IRBC	1654
23	200	0	0	0	Chairperson’s Office; Ex...g and Corporate Affairs	Chairperson’s Office; Executive Director’s Office; Integrity Office; Governor in Council Secretariat Services; Policy, Planning and Corporate Affairs	COECA	2	IRBC	Immigration and Refugee Boa...	COECA	Chairperson’s Office; Execu...					IRBC/COECA	1655
23	201	0	0	0	Integrated Resource Management Branch	Integrated Resource Management Branch	IRMB	2	IRBC	Immigration and Refugee Boa...	IRMB	Integrated Resource Managem...					IRBC/IRMB	1656
23	202	0	0	0	Legal Services	Legal Services	LS	2	IRBC	Immigration and Refugee Boa...	LS	Legal Services					IRBC/LS	1657
23	203	0	0	0	Tribunal Services	Tribunal Services	TS	2	IRBC	Immigration and Refugee Boa...	TS	Tribunal Services					IRBC/TS	1658
23	203	300	0	0	IM-IT	IM/IT	IM-	3	IRBC	Immigration and Refugee Boa...	TS	Tribunal Services	IM-	IM/IT			IRBC/TS/IM-	1659
23	203	301	0	0	RRSS - All Regions	RRSS - All Regions	RR-AR	3	IRBC	Immigration and Refugee Boa...	TS	Tribunal Services	RR-AR	RRSS - All Regions			IRBC/TS/RR-AR	1660
23	203	301	400	0	Central Region	Central Region	CR	4	IRBC	Immigration and Refugee Boa...	TS	Tribunal Services	RR-AR	RRSS - All Regions	CR	Central Region	IRBC/TS/RR-AR/CR	1661
23	203	301	401	0	Eastern Region	Eastern Region	ER	4	IRBC	Immigration and Refugee Boa...	TS	Tribunal Services	RR-AR	RRSS - All Regions	ER	Eastern Region	IRBC/TS/RR-AR/ER	1662
23	203	301	402	0	National Capital Region and Western Region	National Capital Region and Western Region	NCRWR	4	IRBC	Immigration and Refugee Boa...	TS	Tribunal Services	RR-AR	RRSS - All Regions	NCRWR	National Capital Region and...	IRBC/TS/RR-AR/NCRWR	1663
23	203	302	0	0	Research, ATIP, Linguistic Services, Planning	Research, ATIP, Linguistic Services, Planning	RALSP	3	IRBC	Immigration and Refugee Boa...	TS	Tribunal Services	RALSP	Research, ATIP, Linguistic ...			IRBC/TS/RALSP	1664
23	204	0	0	0	Immigration Appeal Divis...Refugee Appeal Division	Immigration Appeal Division & Refugee Appeal Division	IADAD	2	IRBC	Immigration and Refugee Boa...	IADAD	Immigration Appeal Division...					IRBC/IADAD	1665
23	205	0	0	0	Immigration Division	Immigration Division	ID	2	IRBC	Immigration and Refugee Boa...	ID	Immigration Division					IRBC/ID	1666
23	206	0	0	0	Refugee Protection Division	Refugee Protection Division	RPD	2	IRBC	Immigration and Refugee Boa...	RPD	Refugee Protection Division					IRBC/RPD	1667
23	206	303	0	0	Central Region	Central Region	CR	3	IRBC	Immigration and Refugee Boa...	RPD	Refugee Protection Division	CR	Central Region			IRBC/RPD/CR	1668
23	206	304	0	0	Eastern Region	Eastern Region	ER	3	IRBC	Immigration and Refugee Boa...	RPD	Refugee Protection Division	ER	Eastern Region			IRBC/RPD/ER	1669
23	206	305	0	0	National Capital Region and Western Region	National Capital Region and Western Region	NCRWR	3	IRBC	Immigration and Refugee Boa...	RPD	Refugee Protection Division	NCRWR	National Capital Region and...			IRBC/RPD/NCRWR	1670
23	999	0	0	0	I cannot find my organizational unit	I cannot find my organizational unit	N/A	2									NA	1671
24	0	0	0	0	Department of Finance Canada	Department of Finance Canada	DFC	1									DFC	1672
24	200	0	0	0	Consultations and Communications Branch	Consultations and Communications Branch	CCB	2	DFC	Department of Finance Canada	CCB	Consultations and Communica...					DFC/CCB	1673
24	201	0	0	0	Economic and Fiscal Policy Branch	Economic and Fiscal Policy Branch	EFPB	2	DFC	Department of Finance Canada	EFPB	Economic and Fiscal Policy ...					DFC/EFPB	1674
24	202	0	0	0	Economic Development and Corporate Finance Branch	Economic Development and Corporate Finance Branch	EDCFB	2	DFC	Department of Finance Canada	EDCFB	Economic Development and Co...					DFC/EDCFB	1675
24	203	0	0	0	Federal-Provincial Relat...nd Social Policy Branch	Federal-Provincial Relations and Social Policy Branch	FRSPB	2	DFC	Department of Finance Canada	FRSPB	Federal-Provincial Relation...					DFC/FRSPB	1676
24	204	0	0	0	Financial Sector Policy Branch	Financial Sector Policy Branch	FSPB	2	DFC	Department of Finance Canada	FSPB	Financial Sector Policy Branch					DFC/FSPB	1677
24	205	0	0	0	International Trade and Finance Branch	International Trade and Finance Branch	ITFB	2	DFC	Department of Finance Canada	ITFB	International Trade and Fin...					DFC/ITFB	1678
24	206	0	0	0	Tax Policy Branch	Tax Policy Branch	TPB	2	DFC	Department of Finance Canada	TPB	Tax Policy Branch					DFC/TPB	1679
24	207	0	0	0	Corporate Services Branch	Corporate Services Branch	CSB	2	DFC	Department of Finance Canada	CSB	Corporate Services Branch					DFC/CSB	1680
24	208	0	0	0	Other Offices (includes ... Audit, and Law Branch)	Other Offices (includes employees in small offices such as Minister's Office, Deputy Minister's Office, Associate Deputy Minister's Office, Office of the Associate Deputy Minister, and G7/G20 & FSB Deputy for Canada, Canada Investment and Savings, Office of the Minister of State, Internal Audit, and Law Branch)	OO.ALB	2	DFC	Department of Finance Canada	OO.ALB	Other Offices (includes emp...					DFC/OO.ALB	1681
24	999	0	0	0	I cannot find my organizational unit	I cannot find my organizational unit	N/A	2									NA	1682
25	0	0	0	0	Canadian Grain Commission	Canadian Grain Commission	CGC	1									CGC	1683
25	200	0	0	0	Executive-Corporate Affa...Finance-Human Resources	Executive/Corporate Affairs/Industry Services HQ/Finance/Human Resources	EAR	2	CGC	Canadian Grain Commission	EAR	Executive/Corporate Affairs...					CGC/EAR	1684
25	201	0	0	0	Grain Research Laboratory	Grain Research Laboratory	GRL	2	CGC	Canadian Grain Commission	GRL	Grain Research Laboratory					CGC/GRL	1685
25	202	0	0	0	Industry Services Eastern	Industry Services Eastern	ISE	2	CGC	Canadian Grain Commission	ISE	Industry Services Eastern					CGC/ISE	1686
25	203	0	0	0	Industry Services Western	Industry Services Western	ISW	2	CGC	Canadian Grain Commission	ISW	Industry Services Western					CGC/ISW	1687
25	204	0	0	0	Information Management and Information Technology	Information Management and Information Technology	IMIT	2	CGC	Canadian Grain Commission	IMIT	Information Management and ...					CGC/IMIT	1688
25	999	0	0	0	I cannot find my organizational unit	I cannot find my organizational unit	N/A	2									NA	1689
26	0	0	0	0	Treasury Board of Canada Secretariat	Treasury Board of Canada Secretariat	TBCS	1									TBCS	1690
26	200	0	0	0	Policy Sectors	Policy Sectors	PS	2	TBCS	Treasury Board of Canada Se...	PS	Policy Sectors					TBCS/PS	1691
26	200	300	0	0	Canadian Digital Services	Canadian Digital Services	CDS	3	TBCS	Treasury Board of Canada Se...	PS	Policy Sectors	CDS	Canadian Digital Services			TBCS/PS/CDS	1692
26	200	301	0	0	Chief Information Officer Branch	Chief Information Officer Branch	CIOB	3	TBCS	Treasury Board of Canada Se...	PS	Policy Sectors	CIOB	Chief Information Officer B...			TBCS/PS/CIOB	1693
26	200	302	0	0	Expenditure Management Sector	Expenditure Management Sector	EMS	3	TBCS	Treasury Board of Canada Se...	PS	Policy Sectors	EMS	Expenditure Management Sector			TBCS/PS/EMS	1694
26	200	303	0	0	Office of the Chief Human Resources Officer	Office of the Chief Human Resources Officer	OCHRO	3	TBCS	Treasury Board of Canada Se...	PS	Policy Sectors	OCHRO	Office of the Chief Human R...			TBCS/PS/OCHRO	1695
26	200	303	400	0	Compensation and Labour Relations Sector	Compensation and Labour Relations Sector	CLRS	4	TBCS	Treasury Board of Canada Se...	PS	Policy Sectors	OCHRO	Office of the Chief Human R...	CLRS	Compensation and Labour Rel...	TBCS/PS/OCHRO/CLRS	1696
26	200	303	401	0	Executive Management and Leadership Development	Executive Management and Leadership Development	EMLD	4	TBCS	Treasury Board of Canada Se...	PS	Policy Sectors	OCHRO	Office of the Chief Human R...	EMLD	Executive Management and Le...	TBCS/PS/OCHRO/EMLD	1697
26	200	303	402	0	Governance, Planning and Policy Sector	Governance, Planning and Policy Sector	GPPS	4	TBCS	Treasury Board of Canada Se...	PS	Policy Sectors	OCHRO	Office of the Chief Human R...	GPPS	Governance, Planning and Po...	TBCS/PS/OCHRO/GPPS	1698
26	200	303	403	0	Human Resources Management Transformation Sector	Human Resources Management Transformation Sector	HRMTS	4	TBCS	Treasury Board of Canada Se...	PS	Policy Sectors	OCHRO	Office of the Chief Human R...	HRMTS	Human Resources Management ...	TBCS/PS/OCHRO/HRMTS	1699
26	200	303	404	0	Pensions and Benefits Sector	Pensions and Benefits Sector	PBS	4	TBCS	Treasury Board of Canada Se...	PS	Policy Sectors	OCHRO	Office of the Chief Human R...	PBS	Pensions and Benefits Sector	TBCS/PS/OCHRO/PBS	1700
26	200	304	0	0	Office of the Comptroller General	Office of the Comptroller General	OCG	3	TBCS	Treasury Board of Canada Se...	PS	Policy Sectors	OCG	Office of the Comptroller G...			TBCS/PS/OCG	1701
26	200	304	405	0	Acquired Services and Assets Sector	Acquired Services and Assets Sector	ASAS	4	TBCS	Treasury Board of Canada Se...	PS	Policy Sectors	OCG	Office of the Comptroller G...	ASAS	Acquired Services and Asset...	TBCS/PS/OCG/ASAS	1702
26	200	304	406	0	Financial Management Sector	Financial Management Sector	FMS	4	TBCS	Treasury Board of Canada Se...	PS	Policy Sectors	OCG	Office of the Comptroller G...	FMS	Financial Management Sector	TBCS/PS/OCG/FMS	1703
26	200	304	407	0	Financial Management Transformation Sector	Financial Management Transformation Sector	FMTS	4	TBCS	Treasury Board of Canada Se...	PS	Policy Sectors	OCG	Office of the Comptroller G...	FMTS	Financial Management Transf...	TBCS/PS/OCG/FMTS	1704
26	200	304	408	0	Internal Audit Sector	Internal Audit Sector	IAS	4	TBCS	Treasury Board of Canada Se...	PS	Policy Sectors	OCG	Office of the Comptroller G...	IAS	Internal Audit Sector	TBCS/PS/OCG/IAS	1705
26	200	305	0	0	Regulatory Affairs Sector	Regulatory Affairs Sector	RAS	3	TBCS	Treasury Board of Canada Se...	PS	Policy Sectors	RAS	Regulatory Affairs Sector			TBCS/PS/RAS	1706
26	201	0	0	0	Program Sectors	Program Sectors	PS	2	TBCS	Treasury Board of Canada Se...	PS	Program Sectors					TBCS/PS	1707
26	201	306	0	0	Economic Sector	Economic Sector	ES	3	TBCS	Treasury Board of Canada Se...	PS	Program Sectors	ES	Economic Sector			TBCS/PS/ES	1708
26	201	307	0	0	Government Operations Sector	Government Operations Sector	GOS	3	TBCS	Treasury Board of Canada Se...	PS	Program Sectors	GOS	Government Operations Sector			TBCS/PS/GOS	1709
26	201	308	0	0	International Affairs, Security and Justice Sector	International Affairs, Security and Justice Sector	IASJS	3	TBCS	Treasury Board of Canada Se...	PS	Program Sectors	IASJS	International Affairs, Secu...			TBCS/PS/IASJS	1710
26	201	309	0	0	Social and Cultural Sector	Social and Cultural Sector	SCS	3	TBCS	Treasury Board of Canada Se...	PS	Program Sectors	SCS	Social and Cultural Sector			TBCS/PS/SCS	1711
26	202	0	0	0	Enabling Sectors	Enabling Sectors	ES	2	TBCS	Treasury Board of Canada Se...	ES	Enabling Sectors					TBCS/ES	1712
26	202	310	0	0	Corporate Services Sector	Corporate Services Sector	CSS	3	TBCS	Treasury Board of Canada Se...	ES	Enabling Sectors	CSS	Corporate Services Sector			TBCS/ES/CSS	1713
26	202	311	0	0	Human Resources Division	Human Resources Division	HRDv	3	TBCS	Treasury Board of Canada Se...	ES	Enabling Sectors	HRDv	Human Resources Division			TBCS/ES/HRDv	1714
26	202	312	0	0	Internal Audit and Evaluation Bureau	Internal Audit and Evaluation Bureau	IAEB	3	TBCS	Treasury Board of Canada Se...	ES	Enabling Sectors	IAEB	Internal Audit and Evaluati...			TBCS/ES/IAEB	1715
26	202	313	0	0	Legal Services	Legal Services	LS	3	TBCS	Treasury Board of Canada Se...	ES	Enabling Sectors	LS	Legal Services			TBCS/ES/LS	1716
26	202	314	0	0	Priorities and Planning Sector	Priorities and Planning Sector	PPS	3	TBCS	Treasury Board of Canada Se...	ES	Enabling Sectors	PPS	Priorities and Planning Sector			TBCS/ES/PPS	1717
26	202	315	0	0	Strategic Communications...isterial Affairs Sector	Strategic Communications and Ministerial Affairs Sector	SCAS	3	TBCS	Treasury Board of Canada Se...	ES	Enabling Sectors	SCAS	Strategic Communications an...			TBCS/ES/SCAS	1718
26	203	0	0	0	Minister's and Deputy Ministers' Offices	Minister's and Deputy Ministers' Offices	MDMO	2	TBCS	Treasury Board of Canada Se...	MDMO	Minister's and Deputy Minis...					TBCS/MDMO	1719
26	999	0	0	0	I cannot find my organizational unit	I cannot find my organizational unit	N/A	2									NA	1720
28	0	0	0	0	Privy Council Office	Privy Council Office	PCO	1									PCO	1721
28	200	0	0	0	Office of the Clerk of t...ecretary to the Cabinet	Office of the Clerk of the Privy Council and Secretary to the Cabinet / Deputy Clerk of the Privy Council and Associate Secretary to the Cabinet	OCC	2	PCO	Privy Council Office	OCC	Office of the Clerk of the ...					PCO/OCC	1722
28	200	300	0	0	Office of the Clerk of t...ation- Special Projects	Office of the Clerk of the Privy Council and Secretary to the Cabinet / Deputy Clerk of the Privy Council and Associate Secretary to the Cabinet / Audit and Evaluation/ Special Projects	OCSP	3	PCO	Privy Council Office	OCC	Office of the Clerk of the ...	OCSP	Office of the Clerk of the ...			PCO/OCC/OCSP	1723
28	200	301	0	0	Counsel to the Clerk- Ca...lity - Legal Operations	Counsel to the Clerk/ Cabinet Confidentiality / Legal Operations	CCC-LO	3	PCO	Privy Council Office	OCC	Office of the Clerk of the ...	CCC-LO	Counsel to the Clerk/ Cabin...			PCO/OCC/CCC-LO	1724
28	201	0	0	0	Office of the National S...r to the Prime Minister	Office of the National Security and Intelligence Advisor to the Prime Minister	ONSPM	2	PCO	Privy Council Office	ONSPM	Office of the National Secu...					PCO/ONSPM	1725
28	201	302	0	0	Office of the NSIA - Off...r to the Prime Minister	Office of the NSIA / Office of the Foreign and Defence Policy Advisor to the Prime Minister	ON-OPM	3	PCO	Privy Council Office	ONSPM	Office of the National Secu...	ON-OPM	Office of the NSIA / Office...			PCO/ONSPM/ON-OPM	1726
28	201	303	0	0	Security and Intelligence	Security and Intelligence	SI	3	PCO	Privy Council Office	ONSPM	Office of the National Secu...	SI	Security and Intelligence			PCO/ONSPM/SI	1727
28	201	303	400	0	Security Operations	Security Operations	SO	4	PCO	Privy Council Office	ONSPM	Office of the National Secu...	SI	Security and Intelligence	SO	Security Operations	PCO/ONSPM/SI/SO	1728
28	201	304	0	0	Intelligence Assessment	Intelligence Assessment	IA	3	PCO	Privy Council Office	ONSPM	Office of the National Secu...	IA	Intelligence Assessment			PCO/ONSPM/IA	1729
28	202	0	0	0	Governance	Governance	G	2	PCO	Privy Council Office	G	Governance					PCO/G	1730
28	202	305	0	0	Office of the Deputy Sec...Democratic Institutions	Office of the Deputy Secretary to the Cabinet / Parliamentary Affairs / Machinery of Government and Democratic Institutions	ODSI	3	PCO	Privy Council Office	G	Governance	ODSI	Office of the Deputy Secret...			PCO/G/ODSI	1731
28	203	0	0	0	Plans and Consultations	Plans and Consultations	PC	2	PCO	Privy Council Office	PC	Plans and Consultations					PCO/PC	1732
28	203	306	0	0	Office of the Deputy Sec...Priorities and Planning	Office of the Deputy Secretary to the Cabinet / Liaison Secretariat for Macroeconomic Policy / Priorities and Planning	ODSP	3	PCO	Privy Council Office	PC	Plans and Consultations	ODSP	Office of the Deputy Secret...			PCO/PC/ODSP	1733
28	203	307	0	0	Communications & Consultations	Communications & Consultations	C&C	3	PCO	Privy Council Office	PC	Plans and Consultations	C&C	Communications & Consultations			PCO/PC/C&C	1734
28	204	0	0	0	Operations	Operations	O	2	PCO	Privy Council Office	O	Operations					PCO/O	1735
28	204	308	0	0	Economic and Regional De...cial Development Policy	Economic and Regional Development Policy / Social Development Policy	ERDDP	3	PCO	Privy Council Office	O	Operations	ERDDP	Economic and Regional Devel...			PCO/O/ERDDP	1736
28	204	309	0	0	Operations and Cabinet Affairs - Orders in Council	Operations and Cabinet Affairs / Orders in Council	OCA-OC	3	PCO	Privy Council Office	O	Operations	OCA-OC	Operations and Cabinet Affa...			PCO/O/OCA-OC	1737
28	205	0	0	0	Senior Personnel and Public Service Renewal	Senior Personnel and Public Service Renewal	SPPSR	2	PCO	Privy Council Office	SPPSR	Senior Personnel and Public...					PCO/SPPSR	1738
28	205	310	0	0	Public Service Renewal	Public Service Renewal	PSR	3	PCO	Privy Council Office	SPPSR	Senior Personnel and Public...	PSR	Public Service Renewal			PCO/SPPSR/PSR	1739
28	205	311	0	0	Senior Personnel Secretariat	Senior Personnel Secretariat	SPS	3	PCO	Privy Council Office	SPPSR	Senior Personnel and Public...	SPS	Senior Personnel Secretariat			PCO/SPPSR/SPS	1740
28	206	0	0	0	Corporate Services	Corporate Services	CS	2	PCO	Privy Council Office	CS	Corporate Services					PCO/CS	1741
28	206	312	0	0	Access to Information, P...e Parliamentary Returns	Access to Information, Privacy and Privy Council Office Parliamentary Returns	AIPPR	3	PCO	Privy Council Office	CS	Corporate Services	AIPPR	Access to Information, Priv...			PCO/CS/AIPPR	1742
28	206	313	0	0	Finance and Planning Directorate	Finance and Planning Directorate	FPD	3	PCO	Privy Council Office	CS	Corporate Services	FPD	Finance and Planning Direct...			PCO/CS/FPD	1743
28	206	314	0	0	Administration	Administration	A	3	PCO	Privy Council Office	CS	Corporate Services	A	Administration			PCO/CS/A	1744
28	206	315	0	0	Human Resources	Human Resources	HR	3	PCO	Privy Council Office	CS	Corporate Services	HR	Human Resources			PCO/CS/HR	1745
28	206	316	0	0	Chief Information Officer Directorate	Chief Information Officer Directorate	CIOD	3	PCO	Privy Council Office	CS	Corporate Services	CIOD	Chief Information Officer D...			PCO/CS/CIOD	1746
28	207	0	0	0	Results and Delivery	Results and Delivery	RD	2	PCO	Privy Council Office	RD	Results and Delivery					PCO/RD	1747
28	207	317	0	0	Office of the Deputy Sec... Central Innovation Hub	Office of the Deputy Secretary to the Cabinet / Results and Delivery / Central Innovation Hub	ODSCIH	3	PCO	Privy Council Office	RD	Results and Delivery	ODSCIH	Office of the Deputy Secret...			PCO/RD/ODSCIH	1748
28	208	0	0	0	Intergovernmental Affairs and Youth Secretariat	Intergovernmental Affairs and Youth Secretariat	IAYS	2	PCO	Privy Council Office	IAYS	Intergovernmental Affairs a...					PCO/IAYS	1749
28	208	318	0	0	Intergovernmental Affairs	Intergovernmental Affairs	IA	3	PCO	Privy Council Office	IAYS	Intergovernmental Affairs a...	IA	Intergovernmental Affairs			PCO/IAYS/IA	1750
28	208	319	0	0	Youth Secretariat	Youth Secretariat	YS	3	PCO	Privy Council Office	IAYS	Intergovernmental Affairs a...	YS	Youth Secretariat			PCO/IAYS/YS	1751
28	999	0	0	0	I cannot find my organizational unit	I cannot find my organizational unit	N/A	2									NA	1752
29	0	0	0	0	National Capital Commission	National Capital Commission	NCC	1									NCC	1753
29	200	0	0	0	Executive Office - Legal...c and Corporate Affairs	Executive Office / Legal Services and Commission Secretariat /Audit, Research, Evaluation and Ethics / Public and Corporate Affairs	EO-LCA	2	NCC	National Capital Commission	EO-LCA	Executive Office / Legal Se...					NCC/EO-LCA	1754
29	201	0	0	0	Capital Stewardship	Capital Stewardship	CS	2	NCC	National Capital Commission	CS	Capital Stewardship					NCC/CS	1755
29	202	0	0	0	Capital Planning	Capital Planning	CP	2	NCC	National Capital Commission	CP	Capital Planning					NCC/CP	1756
29	203	0	0	0	Corporate Services	Corporate Services	CS	2	NCC	National Capital Commission	CS	Corporate Services					NCC/CS	1757
29	204	0	0	0	Official Residences	Official Residences	OR	2	NCC	National Capital Commission	OR	Official Residences					NCC/OR	1758
29	999	0	0	0	I cannot find my organizational unit	I cannot find my organizational unit	N/A	2									NA	1759
30	0	0	0	0	Courts Administration Service	Courts Administration Service	CAS	1									CAS	1760
30	200	0	0	0	Corporate Secretariat and Corporate Services	Corporate Secretariat and Corporate Services	CSCS	2	CAS	Courts Administration Service	CSCS	Corporate Secretariat and C...					CAS/CSCS	1761
30	201	0	0	0	National Capital Region ...l and Registry Services	National Capital Region - Judicial and Registry Services	NCR.RS	2	CAS	Courts Administration Service	NCR.RS	National Capital Region - J...					CAS/NCR.RS	1762
30	202	0	0	0	Eastern, Ontario and Wes...l and Registry Services	Eastern, Ontario and Western Regions - Judicial and Registry Services	EOWRS	2	CAS	Courts Administration Service	EOWRS	Eastern, Ontario and Wester...					CAS/EOWRS	1763
30	999	0	0	0	I cannot find my organizational unit	I cannot find my organizational unit	N/A	2									NA	1764
31	0	0	0	0	Canadian Radio-televisio...mmunications Commission	Canadian Radio-television and Telecommunications Commission	CR-C	1									CR-C	1765
31	200	0	0	0	Broadcasting	Broadcasting	B	2	CR-C	Canadian Radio-television a...	B	Broadcasting					CR-C/B	1766
31	201	0	0	0	Compliance and Enforcement (including Montreal)	Compliance and Enforcement (including Montreal)	CEM	2	CR-C	Canadian Radio-television a...	CEM	Compliance and Enforcement ...					CR-C/CEM	1767
31	202	0	0	0	Consumer Affairs and Strategic Policy	Consumer Affairs and Strategic Policy	CASP	2	CR-C	Canadian Radio-television a...	CASP	Consumer Affairs and Strate...					CR-C/CASP	1768
31	203	0	0	0	Communications and External Relations	Communications and External Relations	CER	2	CR-C	Canadian Radio-television a...	CER	Communications and External...					CR-C/CER	1769
31	204	0	0	0	Corporate Services and Operations	Corporate Services and Operations	CSO	2	CR-C	Canadian Radio-television a...	CSO	Corporate Services and Oper...					CR-C/CSO	1770
31	204	300	0	0	Information Management and Technology (IM-IT)	Information Management and Technology (IM/IT)	IMT	3	CR-C	Canadian Radio-television a...	CSO	Corporate Services and Oper...	IMT	Information Management and ...			CR-C/CSO/IMT	1771
31	204	301	0	0	Human Resources	Human Resources	HR	3	CR-C	Canadian Radio-television a...	CSO	Corporate Services and Oper...	HR	Human Resources			CR-C/CSO/HR	1772
31	204	302	0	0	Finance & Administrative Services	Finance & Administrative Services	F&AS	3	CR-C	Canadian Radio-television a...	CSO	Corporate Services and Oper...	F&AS	Finance & Administrative Se...			CR-C/CSO/F&AS	1773
31	204	303	0	0	Planning & Process	Planning & Process	P&P	3	CR-C	Canadian Radio-television a...	CSO	Corporate Services and Oper...	P&P	Planning & Process			CR-C/CSO/P&P	1774
31	204	304	0	0	Decisions Division	Decisions Division	DD	3	CR-C	Canadian Radio-television a...	CSO	Corporate Services and Oper...	DD	Decisions Division			CR-C/CSO/DD	1775
31	204	305	0	0	Secretary General's Office-Chairman's Office	Secretary General's Office/Chairman's Office	SGOO	3	CR-C	Canadian Radio-television a...	CSO	Corporate Services and Oper...	SGOO	Secretary General's Office/...			CR-C/CSO/SGOO	1776
31	205	0	0	0	Legal Services	Legal Services	LS	2	CR-C	Canadian Radio-television a...	LS	Legal Services					CR-C/LS	1777
31	206	0	0	0	Telecommunications	Telecommunications	T	2	CR-C	Canadian Radio-television a...	T	Telecommunications					CR-C/T	1778
31	999	0	0	0	I cannot find my organizational unit	I cannot find my organizational unit	N/A	2									NA	1779
32	0	0	0	0	Atlantic Canada Opportunities Agency	Atlantic Canada Opportunities Agency	ACOA	1									ACOA	1780
32	200	0	0	0	Head Office	Head Office	HO	2	ACOA	Atlantic Canada Opportuniti...	HO	Head Office					ACOA/HO	1781
32	200	300	0	0	FCS - Corporate Services...office - Legal Services	FCS - Corporate Services / Communications / President’s office / Legal Services	F-CS-LS	3	ACOA	Atlantic Canada Opportuniti...	HO	Head Office	F-CS-LS	FCS - Corporate Services / ...			ACOA/HO/F-CS-LS	1782
32	200	301	0	0	PP - Policy & Programs (including Ottawa & MLO)	PP - Policy & Programs (including Ottawa & MLO)	P-P&PO&M	3	ACOA	Atlantic Canada Opportuniti...	HO	Head Office	P-P&PO&M	PP - Policy & Programs (inc...			ACOA/HO/P-P&PO&M	1783
32	201	0	0	0	New Brunswick Region	New Brunswick Region	NBR	2	ACOA	Atlantic Canada Opportuniti...	NBR	New Brunswick Region					ACOA/NBR	1784
32	202	0	0	0	Nova Scotia Region	Nova Scotia Region	NSR	2	ACOA	Atlantic Canada Opportuniti...	NSR	Nova Scotia Region					ACOA/NSR	1785
32	203	0	0	0	Newfoundland and Labrador Region	Newfoundland and Labrador Region	NLR	2	ACOA	Atlantic Canada Opportuniti...	NLR	Newfoundland and Labrador R...					ACOA/NLR	1786
32	204	0	0	0	Prince Edward Island Region	Prince Edward Island Region	PEIR	2	ACOA	Atlantic Canada Opportuniti...	PEIR	Prince Edward Island Region					ACOA/PEIR	1787
32	999	0	0	0	I cannot find my organizational unit	I cannot find my organizational unit	N/A	2									NA	1788
33	0	0	0	0	Canadian Space Agency	Canadian Space Agency	CSA	1									CSA	1789
33	200	0	0	0	President Office - Senio... - Audit and Evaluation	President Office / Senior Vice-President Office / Programs and Integrated Planning / Audit and Evaluation	PO-S-AE	2	CSA	Canadian Space Agency	PO-S-AE	President Office / Senior V...					CSA/PO-S-AE	1790
33	201	0	0	0	Communications and Public Affairs - Politics	Communications and Public Affairs / Politics	CPA-P	2	CSA	Canadian Space Agency	CPA-P	Communications and Public A...					CSA/CPA-P	1791
33	202	0	0	0	Finance	Finance	F	2	CSA	Canadian Space Agency	F	Finance					CSA/F	1792
33	203	0	0	0	Corporate Services and HR	Corporate Services and HR	CSH	2	CSA	Canadian Space Agency	CSH	Corporate Services and HR					CSA/CSH	1793
